Financials (TRBC),9392
Banking and Investment Services (TRBC),7545
Cyclical Consumer Goods and Services (TRBC),6670
Technology (TRBC),5211
Banks (TRBC),4902
Industrials (TRBC),4643
Banking Services (TRBC),4481
Investment Banking and Investment Services (TRBC),4456
Energy (TRBC),3834
Healthcare (TRBC),3384
Investment Management and Fund Operators (TRBC),3352
Oil and Gas (TRBC),3144
Software and IT Services (TRBC),2767
Cyclical Consumer Services (TRBC),2694
Automobiles and Auto Parts (TRBC),2644
Auto and Truck Manufacturers (TRBC),2617
Technology Equipment (TRBC),2614
Pharmaceuticals and Medical Research (TRBC),2584
Non-Cyclical Consumer Goods and Services (TRBC),2406
Telecommunications Services (TRBC),2347
Media and Publishing (TRBC),2327
Generic and Specialty Pharmaceuticals (TRBC),2166
IT Services and Consulting (TRBC),2160
Transportation (TRBC),2110
Basic Materials (TRBC),2107
Retailers excl Food and Drug Specialists (TRBC),2106
Industrial Goods (TRBC),2057
Software (TRBC),1958
Oil and Gas Exploration and Production (TRBC),1921
Food and Beverages (TRBC),1651
Aerospace and Defense (TRBC),1528
Oil and Gas Refining and Marketing (TRBC),1497
Investment Banking and Brokerage Services (TRBC),1466
Pharmaceuticals (TRBC),1450
Specialty Retailers (TRBC),1386
Mineral Resources (TRBC),1369
Metals and Mining (TRBC),1368
Integrated Telecommunications Services (TRBC),1360
Insurance (TRBC),1327
Integrated Oil and Gas (TRBC),1306
Oil and Gas Related Equipment and Services (TRBC),1300
Cyclical Consumer Products (TRBC),1295
Wireless Telecommunications Services (TRBC),1231
Industrial Services (TRBC),1231
Machinery : Equipment and Components (TRBC),1208
Computer Hardware (TRBC),1194
Real Estate (TRBC),1161
Healthcare Services (TRBC),1149
Biotechnology and Medical Research (TRBC),1119
Food and Tobacco (TRBC),1071
Utilities (TRBC),1060
Hotels and Entertainment Services (TRBC),1056
Computers and Office Equipment (TRBC),1045
Semiconductors (TRBC),1041
Food Processing (TRBC),989
Airlines (TRBC),973
Semiconductors and Semiconductor Equipment (TRBC),957
Broadcasting (TRBC),944
Airline Services (TRBC),917
Communications Equipment (TRBC),902
Industrial Conglomerates (TRBC),883
Electrical Components and Equipment (TRBC),831
Auto : Truck and Motorcycle Parts (TRBC),815
Department Stores (TRBC),805
Entertainment Production (TRBC),777
Chemicals (TRBC),771
Food and Drug Retailing (TRBC),758
Oil and Gas Drilling (TRBC),715
Diversified Retail (TRBC),703
Healthcare Equipment and Supplies (TRBC),675
Computer and Electronics Retailers (TRBC),673
Electric Utilities (TRBC),665
Oil Related Services and Equipment (TRBC),658
Iron and Steel (TRBC),655
Specialty Mining and Metals (TRBC),647
Beverages (TRBC),632
Life and Health Insurance (TRBC),629
Real Estate Development and Operations (TRBC),616
Real Estate Operations (TRBC),616
Food Distribution and Convenience Stores (TRBC),603
Precious Metals and Minerals (TRBC),603
Consumer Financial Services (TRBC),599
Apparel and Accessories Retailers (TRBC),571
Advanced Medical Equipment (TRBC),557
Business Support Services (TRBC),552
Construction and Engineering (TRBC),544
Commercial Services and Supplies (TRBC),540
Oil and Gas Transportation Services (TRBC),537
Textiles and Apparel (TRBC),531
Miscellaneous Specialty Retailers (TRBC),520
Advertising and Marketing (TRBC),506
Apparel and Accessories (TRBC),500
Residential and Commercial REITs (TRBC),498
Consumer Electronics (TRBC),481
Diversified Investment Services (TRBC),475
Financial and Commodity Market Operators (TRBC),443
Transportation : Ground (TRBC),424
Commercial REITs (TRBC),357
Healthcare Providers and Services (TRBC),355
